{
  "id": "wpilib.vscode",
  "name": "VS Code",
  "version": "1.105.1",
  "season": 2026,
  "publisher": "wpilib",
  "description": "Visual Studio Code editor for FRC and FTC development. Provides the core IDE experience with extensions for robot programming.",
  "category": "ide",
  "tags": ["ide", "vscode", "editor"],
  "competition": "Frc",
  "license": "MIT",
  "homepage": "https://code.visualstudio.com/",
  "repository": "https://github.com/microsoft/vscode",
  "releaseNotes": "VS Code 1.105.1 with latest stability fixes and performance improvements.",
  "dependencies": [],
  "conflicts": [],
  "artifacts": {
    "win-x64": {
      "url": "https://update.code.visualstudio.com/1.105.1/win32-x64-archive/stable",
      "sha256": "placeholder-sha256-win-x64",
      "size": 105000000,
      "archiveType": "zip",
      "extractPath": "VSCode-win32-x64-1.105.1",
      "filename": "VSCode-win32-x64-1.105.1.zip",
      "mirrors": []
    },
    "linux-x64": {
      "url": "https://update.code.visualstudio.com/1.105.1/linux-x64/stable",
      "sha256": "placeholder-sha256-linux-x64",
      "size": 100000000,
      "archiveType": "tar.gz",
      "extractPath": "VSCode-linux-x64",
      "filename": "code-stable-x64-1.105.1.tar.gz",
      "mirrors": []
    },
    "linux-arm64": {
      "url": "https://update.code.visualstudio.com/1.105.1/linux-arm64/stable",
      "sha256": "placeholder-sha256-linux-arm64",
      "size": 95000000,
      "archiveType": "tar.gz",
      "extractPath": "VSCode-linux-arm64",
      "filename": "code-stable-arm64-1.105.1.tar.gz",
      "mirrors": []
    },
    "osx-x64": {
      "url": "https://update.code.visualstudio.com/1.105.1/darwin/stable",
      "sha256": "placeholder-sha256-osx-x64",
      "size": 105000000,
      "archiveType": "zip",
      "extractPath": "Visual Studio Code.app",
      "filename": "VSCode-darwin-x64-1.105.1.zip",
      "mirrors": []
    },
    "osx-arm64": {
      "url": "https://update.code.visualstudio.com/1.105.1/darwin-arm64/stable",
      "sha256": "placeholder-sha256-osx-arm64",
      "size": 100000000,
      "archiveType": "zip",
      "extractPath": "Visual Studio Code.app",
      "filename": "VSCode-darwin-arm64-1.105.1.zip",
      "mirrors": []
    }
  },
  "install": {
    "installDir": "vscode",
    "requiresAdmin": false,
    "postInstall": [
      {
        "action": "add-to-path",
        "platform": "windows",
        "params": {
          "path": "${installDir}\\vscode\\bin",
          "scope": "user"
        }
      },
      {
        "action": "add-to-path",
        "platform": "linux",
        "params": {
          "path": "${installDir}/vscode/bin"
        }
      },
      {
        "action": "add-to-path",
        "platform": "osx",
        "params": {
          "path": "${installDir}/vscode/bin"
        }
      }
    ]
  },
  "deprecated": false
}
